{
  "profile": "output.decision-brief",
  "status": "COMPLETED",
  "format": "markdown",
  "language": "en",
  "result": {
    "recommendation": "Proceed with the smallest reversible option.",
    "rationale": "It meets the stated objective with the lowest material risk and overhead."
  },
  "evidence": [
    {
      "class": "SUPPORTED",
      "claim": "The selected option satisfies the evaluated criteria."
    }
  ],
  "assumptions": [],
  "risks": ["Requirements may change after implementation begins."],
  "next_actions": ["Confirm the decision and begin the first atomic work unit."],
  "artifacts": [],
  "verification": {
    "status": "PASS",
    "checks": ["required fields present", "recommendation is actionable"]
  }
}
